{
  "block_size": 48,
  "list_hash": "sha256:0b2d442b2c8b9f83a2296decd9f5c4f5d2940b29a8be062edf840b6f25952a4a",
  "randomization_version": "1.0",
  "records": [
    {
      "allocation_index": 1,
      "arm": "balanced_random",
      "arm_behavior_probability": 0.5,
      "block": 1,
      "stage": "stage_3",
      "stratum": "synthetic_stratum_a",
      "weather_sequence": [
        "fade",
        "snow",
        "storm",
        "heat"
      ]
    },
    {
      "allocation_index": 2,
      "arm": "frozen_policy",
      "arm_behavior_probability": 0.5,
      "block": 1,
      "stage": "stage_3",
      "stratum": "synthetic_stratum_a",
      "weather_sequence": null
    },
    {
      "allocation_index": 3,
      "arm": "balanced_random",
      "arm_behavior_probability": 0.5,
      "block": 1,
      "stage": "stage_3",
      "stratum": "synthetic_stratum_a",
      "weather_sequence": [
        "fade",
        "storm",
        "heat",
        "snow"
      ]
    },
    {
      "allocation_index": 4,
      "arm": "frozen_policy",
      "arm_behavior_probability": 0.5,
      "block": 1,
      "stage": "stage_3",
      "stratum": "synthetic_stratum_a",
      "weather_sequence": null
    },
    {
      "allocation_index": 5,
      "arm": "balanced_random",
      "arm_behavior_probability": 0.5,
      "block": 1,
      "stage": "stage_3",
      "stratum": "synthetic_stratum_a",
      "weather_sequence": [
        "snow",
        "heat",
        "fade",
        "storm"
      ]
    },
    {
      "allocation_index": 6,
      "arm": "balanced_random",
      "arm_behavior_probability": 0.5,
      "block": 1,
      "stage": "stage_3",
      "stratum": "synthetic_stratum_a",
      "weather_sequence": [
        "storm",
        "fade",
        "heat",
        "snow"
      ]
    },
    {
      "allocation_index": 7,
      "arm": "frozen_policy",
      "arm_behavior_probability": 0.5,
      "block": 1,
      "stage": "stage_3",
      "stratum": "synthetic_stratum_a",
      "weather_sequence": null
    },
    {
      "allocation_index": 8,
      "arm": "frozen_policy",
      "arm_behavior_probability": 0.5,
      "block": 1,
      "stage": "stage_3",
      "stratum": "synthetic_stratum_a",
      "weather_sequence": null
    },
    {
      "allocation_index": 9,
      "arm": "balanced_random",
      "arm_behavior_probability": 0.5,
      "block": 1,
      "stage": "stage_3",
      "stratum": "synthetic_stratum_a",
      "weather_sequence": [
        "snow",
        "heat",
        "storm",
        "fade"
      ]
    },
    {
      "allocation_index": 10,
      "arm": "frozen_policy",
      "arm_behavior_probability": 0.5,
      "block": 1,
      "stage": "stage_3",
      "stratum": "synthetic_stratum_a",
      "weather_sequence": null
    },
    {
      "allocation_index": 11,
      "arm": "frozen_policy",
      "arm_behavior_probability": 0.5,
      "block": 1,
      "stage": "stage_3",
      "stratum": "synthetic_stratum_a",
      "weather_sequence": null
    },
    {
      "allocation_index": 12,
      "arm": "frozen_policy",
      "arm_behavior_probability": 0.5,
      "block": 1,
      "stage": "stage_3",
      "stratum": "synthetic_stratum_a",
      "weather_sequence": null
    },
    {
      "allocation_index": 13,
      "arm": "balanced_random",
      "arm_behavior_probability": 0.5,
      "block": 1,
      "stage": "stage_3",
      "stratum": "synthetic_stratum_a",
      "weather_sequence": [
        "heat",
        "snow",
        "fade",
        "storm"
      ]
    },
    {
      "allocation_index": 14,
      "arm": "frozen_policy",
      "arm_behavior_probability": 0.5,
      "block": 1,
      "stage": "stage_3",
      "stratum": "synthetic_stratum_a",
      "weather_sequence": null
    },
    {
      "allocation_index": 15,
      "arm": "balanced_random",
      "arm_behavior_probability": 0.5,
      "block": 1,
      "stage": "stage_3",
      "stratum": "synthetic_stratum_a",
      "weather_sequence": [
        "storm",
        "snow",
        "heat",
        "fade"
      ]
    },
    {
      "allocation_index": 16,
      "arm": "frozen_policy",
      "arm_behavior_probability": 0.5,
      "block": 1,
      "stage": "stage_3",
      "stratum": "synthetic_stratum_a",
      "weather_sequence": null
    },
    {
      "allocation_index": 17,
      "arm": "balanced_random",
      "arm_behavior_probability": 0.5,
      "block": 1,
      "stage": "stage_3",
      "stratum": "synthetic_stratum_a",
      "weather_sequence": [
        "heat",
        "fade",
        "snow",
        "storm"
      ]
    },
    {
      "allocation_index": 18,
      "arm": "balanced_random",
      "arm_behavior_probability": 0.5,
      "block": 1,
      "stage": "stage_3",
      "stratum": "synthetic_stratum_a",
      "weather_sequence": [
        "heat",
        "storm",
        "snow",
        "fade"
      ]
    },
    {
      "allocation_index": 19,
      "arm": "frozen_policy",
      "arm_behavior_probability": 0.5,
      "block": 1,
      "stage": "stage_3",
      "stratum": "synthetic_stratum_a",
      "weather_sequence": null
    },
    {
      "allocation_index": 20,
      "arm": "frozen_policy",
      "arm_behavior_probability": 0.5,
      "block": 1,
      "stage": "stage_3",
      "stratum": "synthetic_stratum_a",
      "weather_sequence": null
    },
    {
      "allocation_index": 21,
      "arm": "frozen_policy",
      "arm_behavior_probability": 0.5,
      "block": 1,
      "stage": "stage_3",
      "stratum": "synthetic_stratum_a",
      "weather_sequence": null
    },
    {
      "allocation_index": 22,
      "arm": "balanced_random",
      "arm_behavior_probability": 0.5,
      "block": 1,
      "stage": "stage_3",
      "stratum": "synthetic_stratum_a",
      "weather_sequence": [
        "fade",
        "heat",
        "snow",
        "storm"
      ]
    },
    {
      "allocation_index": 23,
      "arm": "frozen_policy",
      "arm_behavior_probability": 0.5,
      "block": 1,
      "stage": "stage_3",
      "stratum": "synthetic_stratum_a",
      "weather_sequence": null
    },
    {
      "allocation_index": 24,
      "arm": "frozen_policy",
      "arm_behavior_probability": 0.5,
      "block": 1,
      "stage": "stage_3",
      "stratum": "synthetic_stratum_a",
      "weather_sequence": null
    },
    {
      "allocation_index": 25,
      "arm": "balanced_random",
      "arm_behavior_probability": 0.5,
      "block": 1,
      "stage": "stage_3",
      "stratum": "synthetic_stratum_a",
      "weather_sequence": [
        "snow",
        "fade",
        "heat",
        "storm"
      ]
    },
    {
      "allocation_index": 26,
      "arm": "balanced_random",
      "arm_behavior_probability": 0.5,
      "block": 1,
      "stage": "stage_3",
      "stratum": "synthetic_stratum_a",
      "weather_sequence": [
        "fade",
        "heat",
        "storm",
        "snow"
      ]
    },
    {
      "allocation_index": 27,
      "arm": "balanced_random",
      "arm_behavior_probability": 0.5,
      "block": 1,
      "stage": "stage_3",
      "stratum": "synthetic_stratum_a",
      "weather_sequence": [
        "storm",
        "fade",
        "snow",
        "heat"
      ]
    },
    {
      "allocation_index": 28,
      "arm": "frozen_policy",
      "arm_behavior_probability": 0.5,
      "block": 1,
      "stage": "stage_3",
      "stratum": "synthetic_stratum_a",
      "weather_sequence": null
    },
    {
      "allocation_index": 29,
      "arm": "frozen_policy",
      "arm_behavior_probability": 0.5,
      "block": 1,
      "stage": "stage_3",
      "stratum": "synthetic_stratum_a",
      "weather_sequence": null
    },
    {
      "allocation_index": 30,
      "arm": "balanced_random",
      "arm_behavior_probability": 0.5,
      "block": 1,
      "stage": "stage_3",
      "stratum": "synthetic_stratum_a",
      "weather_sequence": [
        "heat",
        "fade",
        "storm",
        "snow"
      ]
    },
    {
      "allocation_index": 31,
      "arm": "balanced_random",
      "arm_behavior_probability": 0.5,
      "block": 1,
      "stage": "stage_3",
      "stratum": "synthetic_stratum_a",
      "weather_sequence": [
        "fade",
        "storm",
        "snow",
        "heat"
      ]
    },
    {
      "allocation_index": 32,
      "arm": "frozen_policy",
      "arm_behavior_probability": 0.5,
      "block": 1,
      "stage": "stage_3",
      "stratum": "synthetic_stratum_a",
      "weather_sequence": null
    },
    {
      "allocation_index": 33,
      "arm": "frozen_policy",
      "arm_behavior_probability": 0.5,
      "block": 1,
      "stage": "stage_3",
      "stratum": "synthetic_stratum_a",
      "weather_sequence": null
    },
    {
      "allocation_index": 34,
      "arm": "balanced_random",
      "arm_behavior_probability": 0.5,
      "block": 1,
      "stage": "stage_3",
      "stratum": "synthetic_stratum_a",
      "weather_sequence": [
        "snow",
        "fade",
        "storm",
        "heat"
      ]
    },
    {
      "allocation_index": 35,
      "arm": "balanced_random",
      "arm_behavior_probability": 0.5,
      "block": 1,
      "stage": "stage_3",
      "stratum": "synthetic_stratum_a",
      "weather_sequence": [
        "snow",
        "storm",
        "fade",
        "heat"
      ]
    },
    {
      "allocation_index": 36,
      "arm": "balanced_random",
      "arm_behavior_probability": 0.5,
      "block": 1,
      "stage": "stage_3",
      "stratum": "synthetic_stratum_a",
      "weather_sequence": [
        "heat",
        "storm",
        "fade",
        "snow"
      ]
    },
    {
      "allocation_index": 37,
      "arm": "balanced_random",
      "arm_behavior_probability": 0.5,
      "block": 1,
      "stage": "stage_3",
      "stratum": "synthetic_stratum_a",
      "weather_sequence": [
        "fade",
        "snow",
        "heat",
        "storm"
      ]
    },
    {
      "allocation_index": 38,
      "arm": "frozen_policy",